<?xml version="1.0" encoding="UTF-8" standalone="no"?>
<!DOCTYPE redtube SYSTEM "Canciones_val.dtd">   

<redtube xmlns:xsi="http://www.w3.org/2001/XMLSchema-instance" xsi:noNamespaceSchemaLocation="Canciones_schema.xsd">

    <playlist nombre="Gean">

        <cancion num="1">
            <titulo>Siempre tuyo</titulo>
            <cantante>Tranzas</cantante>
            <duracion>4:00 min.</duracion>
            <genero>Pop</genero>
            <album>Tranzas por siempre</album>
            <anio>2003</anio>
        </cancion>

        <cancion num="2">
            <titulo>Dos mundos</titulo>
            <cantante>Enjambre</cantante>
            <duracion>3:59 min.</duracion>
            <genero>Pop rock</genero>
            <album>IDK</album>
            <anio>2009</anio>
        </cancion>

        <cancion num="3">
            <titulo>Se√±ales Luminosas</titulo>
            <cantante>Gustavo Cerati</cantante>
            <duracion>3:59 min.</duracion>
            <genero>Pop rock</genero>
            <album>Siempre Es Hoy</album>
            <anio>2002</anio>
        </cancion>

    </playlist>

</redtube>